<?xml version="1.0" encoding="UTF-8"?>
<usi:gamesession xmlns:usi="http://www.usi.com" xmlns:xsi="http://www.w3.org/2001/XMLSchema-instance" xsi:schemaLocation="http://www.usi.com gamesession.xsd ">
  <usi:questions>
    <usi:question goodchoice="0">
      <usi:label>usi:label</usi:label>
      <usi:choice>usi:choice</usi:choice>
      <usi:choice>usi:choice</usi:choice>
      <usi:choice>usi:choice</usi:choice>
      <usi:choice>usi:choice</usi:choice>
    </usi:question>
    <usi:question goodchoice="0">
      <usi:label>usi:label</usi:label>
      <usi:choice>usi:choice</usi:choice>
      <usi:choice>usi:choice</usi:choice>
      <usi:choice>usi:choice</usi:choice>
      <usi:choice>usi:choice</usi:choice>
    </usi:question>
    <usi:question goodchoice="0">
      <usi:label>usi:label</usi:label>
      <usi:choice>usi:choice</usi:choice>
      <usi:choice>usi:choice</usi:choice>
      <usi:choice>usi:choice</usi:choice>
      <usi:choice>usi:choice</usi:choice>
    </usi:question>
    <usi:question goodchoice="0">
      <usi:label>usi:label</usi:label>
      <usi:choice>usi:choice</usi:choice>
      <usi:choice>usi:choice</usi:choice>
      <usi:choice>usi:choice</usi:choice>
      <usi:choice>usi:choice</usi:choice>
    </usi:question>
    <usi:question goodchoice="0">
      <usi:label>usi:label</usi:label>
      <usi:choice>usi:choice</usi:choice>
      <usi:choice>usi:choice</usi:choice>
      <usi:choice>usi:choice</usi:choice>
      <usi:choice>usi:choice</usi:choice>
    </usi:question>
    <usi:question goodchoice="0">
      <usi:label>usi:label</usi:label>
      <usi:choice>usi:choice</usi:choice>
      <usi:choice>usi:choice</usi:choice>
      <usi:choice>usi:choice</usi:choice>
      <usi:choice>usi:choice</usi:choice>
    </usi:question>
    <usi:question goodchoice="0">
      <usi:label>usi:label</usi:label>
      <usi:choice>usi:choice</usi:choice>
      <usi:choice>usi:choice</usi:choice>
      <usi:choice>usi:choice</usi:choice>
      <usi:choice>usi:choice</usi:choice>
    </usi:question>
    <usi:question goodchoice="0">
      <usi:label>usi:label</usi:label>
      <usi:choice>usi:choice</usi:choice>
      <usi:choice>usi:choice</usi:choice>
      <usi:choice>usi:choice</usi:choice>
      <usi:choice>usi:choice</usi:choice>
    </usi:question>
    <usi:question goodchoice="0">
      <usi:label>usi:label</usi:label>
      <usi:choice>usi:choice</usi:choice>
      <usi:choice>usi:choice</usi:choice>
      <usi:choice>usi:choice</usi:choice>
      <usi:choice>usi:choice</usi:choice>
    </usi:question>
    <usi:question goodchoice="0">
      <usi:label>usi:label</usi:label>
      <usi:choice>usi:choice</usi:choice>
      <usi:choice>usi:choice</usi:choice>
      <usi:choice>usi:choice</usi:choice>
      <usi:choice>usi:choice</usi:choice>
    </usi:question>
    <usi:question goodchoice="0">
      <usi:label>usi:label</usi:label>
      <usi:choice>usi:choice</usi:choice>
      <usi:choice>usi:choice</usi:choice>
      <usi:choice>usi:choice</usi:choice>
      <usi:choice>usi:choice</usi:choice>
    </usi:question>
    <usi:question goodchoice="0">
      <usi:label>usi:label</usi:label>
      <usi:choice>usi:choice</usi:choice>
      <usi:choice>usi:choice</usi:choice>
      <usi:choice>usi:choice</usi:choice>
      <usi:choice>usi:choice</usi:choice>
    </usi:question>
    <usi:question goodchoice="0">
      <usi:label>usi:label</usi:label>
      <usi:choice>usi:choice</usi:choice>
      <usi:choice>usi:choice</usi:choice>
      <usi:choice>usi:choice</usi:choice>
      <usi:choice>usi:choice</usi:choice>
    </usi:question>
    <usi:question goodchoice="0">
      <usi:label>usi:label</usi:label>
      <usi:choice>usi:choice</usi:choice>
      <usi:choice>usi:choice</usi:choice>
      <usi:choice>usi:choice</usi:choice>
      <usi:choice>usi:choice</usi:choice>
    </usi:question>
    <usi:question goodchoice="0">
      <usi:label>usi:label</usi:label>
      <usi:choice>usi:choice</usi:choice>
      <usi:choice>usi:choice</usi:choice>
      <usi:choice>usi:choice</usi:choice>
      <usi:choice>usi:choice</usi:choice>
    </usi:question>
    <usi:question goodchoice="0">
      <usi:label>usi:label</usi:label>
      <usi:choice>usi:choice</usi:choice>
      <usi:choice>usi:choice</usi:choice>
      <usi:choice>usi:choice</usi:choice>
      <usi:choice>usi:choice</usi:choice>
    </usi:question>
    <usi:question goodchoice="0">
      <usi:label>usi:label</usi:label>
      <usi:choice>usi:choice</usi:choice>
      <usi:choice>usi:choice</usi:choice>
      <usi:choice>usi:choice</usi:choice>
      <usi:choice>usi:choice</usi:choice>
    </usi:question>
    <usi:question goodchoice="0">
      <usi:label>usi:label</usi:label>
      <usi:choice>usi:choice</usi:choice>
      <usi:choice>usi:choice</usi:choice>
      <usi:choice>usi:choice</usi:choice>
      <usi:choice>usi:choice</usi:choice>
    </usi:question>
    <usi:question goodchoice="0">
      <usi:label>usi:label</usi:label>
      <usi:choice>usi:choice</usi:choice>
      <usi:choice>usi:choice</usi:choice>
      <usi:choice>usi:choice</usi:choice>
      <usi:choice>usi:choice</usi:choice>
    </usi:question>
    <usi:question goodchoice="0">
      <usi:label>usi:label</usi:label>
      <usi:choice>usi:choice</usi:choice>
      <usi:choice>usi:choice</usi:choice>
      <usi:choice>usi:choice</usi:choice>
      <usi:choice>usi:choice</usi:choice>
    </usi:question>
  </usi:questions>
  <usi:parameters>
    <usi:logintimeout>0</usi:logintimeout>
    <usi:synchrotime>0</usi:synchrotime>
    <usi:nbusersthreshold>0</usi:nbusersthreshold>
    <usi:questiontimeframe>0</usi:questiontimeframe>
    <usi:nbquestions>0</usi:nbquestions>
    <usi:flushusertable>true</usi:flushusertable>
    <usi:trackeduseridmail>usi:trackeduseridmail</usi:trackeduseridmail>
  </usi:parameters>
</usi:gamesession>
